{
  "id": "550e8400-e29b-41d4-a716-446655440100",
  "name": "Jake Toepel",
  "email": "jake@leanscale.com",
  "timezone": "America/Denver",
  "week_start": "monday",
  "is_placeholder": false,
  "profile_photo_url": null,
  "created_at": "2026-01-01T00:00:00Z",
  "updated_at": "2026-01-09T00:00:00Z"
}
